"Commissioner","Date","Location","Entity","Subject"
"Jyrki Katainen","23/01/2015","Davos, Switzerland","BANCO BILBAO VIZCAYA ARGENTARIA","Investment plan"
"Jyrki Katainen","23/01/2015","Davos, Switzerland","Bank of America","Investment plan"
"Jyrki Katainen","23/01/2015","Davos, Switzerland","BT Group plc                                                                                    Confederation of British Industry","Investment plan"
"Jyrki Katainen","23/01/2015","Davos, Switzerland","Institute of International Finance","Investment plan"
"Jyrki Katainen","23/01/2015","Davos, Switzerland","Microsoft Corporation","Investment plan"
"Jyrki Katainen","12/01/2015","Brussels","Meridiam","Investment initiative"
"Jyrki Katainen","09/01/2015","Brussels","Eurometaux","Industrial policy and metals industry"
"Jyrki Katainen","15/12/2014","Bucharest","MICROELECTRONICA S.A.","Investment Initiative Roadshow"
"Jyrki Katainen","13/12/2014","Janakkala","Nokia","Investment initiative"
"Jyrki Katainen","12/12/2014","Fiskars","Outotec Oyj","Investment initiative"
"Jyrki Katainen","11/12/2014","Brussels","Confederation of Finnish Industries EK","Industrial Policy"
"Jyrki Katainen","10/12/2014","Brussels","Vodafone Belgium SA","Investments and innovations in the digital sector"
"Jyrki Katainen","04/12/2014","Brussels","Maa- ja metsätaloustuottajain Keskusliitto – Central Union of Agricultural Producers and Forest Owners","Investment initiative"
"Jyrki Katainen","03/12/2014","Brussels","Suomen Yrittäjät ry","SME Policy"
"Jyrki Katainen","02/12/2014","Brussels","Akava ry","Finnish Labour Unions"
"Jyrki Katainen","01/12/2014","Brussels","Finnish Innovation Fund Sitra","Climate report, renewable energy"
"Cecilia Malmström","21/04/2015","Brussels","Swedish Institute of International Affairs","possibility of cooperation on trade matters"
"Cecilia Malmström","26/03/2015","Bruxelles","Business Europe Day","Investment"
"Cecilia Malmström","26/03/2015","Bruxelles","Mouvement des Entreprises de France","TTIP"
"Cecilia Malmström","23/03/2015","Brussels","European Environmental Bureau                                                                                    Transport and Environment (European Federation for Transport and Environment)","TTIP and Environment"
"Cecilia Malmström","23/03/2015","Brussels","European Policy Centre","TTIP"
"Cecilia Malmström","23/03/2015","Brussels","European Environmental Bureau                                                                                    Transport and Environment (European Federation for Transport and Environment)","TTIP; Environment; Transport"
"Cecilia Malmström","23/03/2015","Brussels","European Policy Centre","TTIP"
"Cecilia Malmström","20/03/2015","Brussels","German Marshall Fund Brussels","TTIP"
"Cecilia Malmström","20/03/2015","Brussels","German Marshall Fund","TTIP"
"Cecilia Malmström","19/03/2015","Brussels","Friends of Europe","TTIP"
"Cecilia Malmström","19/03/2015","Brussels","CM meeting with Harvard Kennedy School + SciencesPo Paris","General presentation"
"Cecilia Malmström","13/03/2015","Brussels","PRIME PR agency","Breakfast on TTIP"
"Cecilia Malmström","13/03/2015","Brussels","Volvo Car Corporation AB","TTIP"
"Cecilia Malmström","13/03/2015","Stockholm","International Chamber of Commerce","European Policies; Business in Global Markets"
"Cecilia Malmström","13/03/2015","Brussels","Private Business University, Japan","TTIP"
"Cecilia Malmström","13/03/2015","Brussels","International Chamber of Commerce","TTIP"
"Cecilia Malmström","12/03/2015","Brussels","Bruegel","TTIP"
"Cecilia Malmström","09/03/2015","Brussels","European Centre for International Political economy","WTO post-Bali"
"Cecilia Malmström","05/03/2015","Brussels","The European Steel Association","TTIP"
"Cecilia Malmström","04/03/2015","Brussels","Scania AB (publ)","TTIP; Trade policy; Brazil"
"Cecilia Malmström","05/02/2015","Brussels","EUROCHAMBRES – Association of European Chambers of Commerce and Industry","TTIP and SME's, European Economic Diplomacy"
"Cecilia Malmström","03/02/2015","Brussels","Alcatel-Lucent","Situation in the telecoms' market and TTIP"
"Cecilia Malmström","02/02/2015","Brussels","Stop TTIP","TTIP/CETA"
"Cecilia Malmström","02/02/2015","Brussels","European Heart Network","Health service and TTIP"
"Cecilia Malmström","02/02/2015","Brussels","BUSINESSEUROPE                                                                                    EUROCHAMBRES – Association of European Chambers of Commerce and Industry                                                                                    EUROPEAN SERVICES FORUM                                                                                    European Round Table of Industrialists                                                                                    American Chamber of Commerce to the European Union                                                                                    Trans-Atlantic Business Council","Speech at Business Alliance for TTIP's Welcome Reception"
"Cecilia Malmström","29/01/2015","Brussels","Investor AB","General EU-Sweden overview and political situation"
"Cecilia Malmström","27/01/2015","Brussels","BUSINESSEUROPE                                                                                    EU–China Business Association","Bilateral investment agreement"
"Cecilia Malmström","27/01/2015","Brussels","European Union Chamber of Commerce in China","EU-China"
"Cecilia Malmström","23/01/2015","Davos, Switzerland","Trans-Atlantic Business Council","TTIP"
"Cecilia Malmström","23/01/2015","Davos Switzerland","Google","Digital Agenda and Trade Policy"
"Cecilia Malmström","19/01/2015","Brussels","European Round Table of Industrialists","TTIP"
"Cecilia Malmström","19/01/2015","Brussels","European Round Table of Industrialists","TTIP"
"Cecilia Malmström","16/01/2015","Brussels","TTIP Advisory Group","TTIP"
"Cecilia Malmström","15/01/2015","Brussels","EUROPEAN TRADE UNION CONFEDERATION","TTIP"
"Cecilia Malmström","15/01/2015","Brussels","UNIFE","EU-Japan FTA negotiations, China's policy on railways within China, within the EU and in third countries' markets and TTIP negotiations"
"Cecilia Malmström","12/01/2015","Brussels","Nordic Hunters' Alliance","Trade in seal products"
"Cecilia Malmström","19/12/2014","Bruxelles","CEEP - European Centre of Employers and Enterprises providing Public Services","Services of economic general services"
"Cecilia Malmström","11/12/2014","Bruxelles","Open Europe","Speech on TTIP"
"Cecilia Malmström","11/12/2014","Brussels","Open Europe                                                                                    Friedrich-Naumann Stiftung","TTIP"
"Cecilia Malmström","08/12/2014","Washington DC","Transatlantic Consumer Dialogue","TTIP"
"Cecilia Malmström","05/12/2014","Bruxelles","Platform of European Social NGOs","SGI (Services of general interest) TTIP-TISA-ISDS"
"Cecilia Malmström","04/12/2014","Bruxelles","Civil society Dialogue meeting","Trade Governance - transparency- stakeholders engagement-event webstreamed"
"Neven Mimica","05/03/2015","Brussels, Belgium","European Disability Forum","The inclusion of persons with disabilities in lower and middle income countries through Commissioner’s work over the next 5 years."
"Neven Mimica","16/02/2015","Brussels,  Belgium","Cooperatives Europe","Present  the PFD and to bring attention the important role the Group  plays in the dialogue with EU institutions on EU development policy issues"
"Neven Mimica","09/02/2015","Brussels, Belgium","International Organization for Migration","Migration policy to discuss general matters regarding the new migration policy of the European Commission"
"Neven Mimica","04/02/2015","Brussels, Belgium","Eni S.p.A.","Discuss private sector engagement for sustainable development"
"Carlos  Moedas","15/04/2015","Brussels","Lindau Nobel Laureate Meetings","Preparation of the 2015 Lindau Meeting/ financing"
"Carlos  Moedas","09/04/2015","Brussels","All European Academies","Meeting with the President of ALLEA"
"Carlos  Moedas","30/03/2015","Brussels","European Association of Research and Technology Organisations","Meeting with the President of EARTO"
"Carlos  Moedas","30/03/2015","Brussels","Eurometaux","Meeting with the Director of Eurometaux"
"Carlos  Moedas","19/03/2015","Brussels","ChinaEU                                                                                    ZTE Europe","EU - China cooperation in the field of telecommunications"
"Carlos  Moedas","18/03/2015","Brussels","World Economic Forum","Meeting with World Economic Forum"
"Carlos  Moedas","13/03/2015","Brussels","SONAE","High Level Forum on Retail Competitiveness Innovation Subgroup"
"Carlos  Moedas","12/03/2015","Brussels","European Venture Fund Investors Network","European Fund for Strategic Investments"
"Carlos  Moedas","06/03/2015","Brussels","THALES","Research and Innovation policies; public private partnerships"
"Carlos  Moedas","04/03/2015","Brussels","CIP - Confederação Empresarial de Portugal","Meeting with the President of CIP"
"Carlos  Moedas","27/02/2015","Brussels","European Chemical Industry Council","Sustainability of the European chemical industry"
"Carlos  Moedas","23/02/2015","Brussels","Galp Energia, SGPS, SA","Oil and gas R&I in Portuguese-speaking countries"
"Carlos  Moedas","13/02/2015","Brussels","Conference of European Schools for Advanced Engineering Education and Research","European Research Area"
"Carlos  Moedas","12/02/2015","Brussels","Conseil de Coopération Economique","Energy Union, Digital Single Market, Horizon 2020"
"Carlos  Moedas","05/02/2015","Brussels","Confederação dos Agricultores de Portugal","Horizon 2020 and the Agro-food sector in Portugal"
"Carlos  Moedas","02/02/2015","Brussels","The European Steel Association","Contribution of EU Steel Industry to Research & Innovation"
"Carlos  Moedas","02/02/2015","Brussels","COMITE EUROPEEN des FABRICANTS de SUCRE                                                                                    Conféderation Européenne des Propriétaires Forestiers                                                                                    European Farmers                                                                                    European agri-cooperatives                                                                                    European Producers Union of Renewable Ethanol                                                                                    EuropaBio                                                                                    Forest-based Sector Technology Platform                                                                                    STARCH EUROPE","Meeting with the European Bioeconomy Alliance on the Bioeconomy Strategy"
"Carlos  Moedas","29/01/2015","Brussels","European Private Equity and Venture Capital Association","Contribution of venture capital to Research & Innovation"
"Carlos  Moedas","27/01/2015","Brussels","European Wind Energy Association","Future of Research and Innovation policies in the sector of wind energy"
"Carlos  Moedas","27/01/2015","Brussels","Universidade de Vigo","Cooperation between Galicia and the North of Portugal in R&I"
"Carlos  Moedas","26/01/2015
            	     
            	     	(Cancelled)","Brussels","European Society of Cardiology","Biomedical Research"
"Carlos  Moedas","26/01/2015","Brussels","European Society of Cardiology","Biomedical Research"
"Carlos  Moedas","23/01/2015","Davos","QUALCOMM Inc.","Bilateral with the President and Executive Vice-President"
"Carlos  Moedas","23/01/2015","Davos","Novartis International AG","Bilateral meeting the CEO of Novartis & EFPIA President"
"Carlos  Moedas","23/01/2015","Davos","Johnson & Johnson","Meeting on Ebola research"
"Carlos  Moedas","22/01/2015","Brussels","Bill & Melinda Gates Foundation","Cooperation with the Bill & Melinda Gates Foundation"
"Carlos  Moedas","20/01/2015","Brussels","Turku-Southwest Finland European office","Contribution of Finland universities to the EU Research Agenda"
"Carlos  Moedas","12/01/2015","Brussels","COTEC Portugal - Associação Empresarial para a Inovação","Presentation of COTEC and its activities to promote innovation in Portugal"
"Carlos  Moedas","18/12/2014","Brussels","European Federation of Pharmaceutical Industries and Associations","European industry’s perspective on the future of EU research and innovation policy"
"Carlos  Moedas","16/12/2014","Strasbourg","Ruggero Schleicher-Tappeser                                                                                    Fraunhofer-Gesellschaft                                                                                    Meyer Burger Technology AG","Meeting with MEP C. Turmes on xGWP – European Gigawatt Fab"
"Carlos  Moedas","09/12/2014","Brussels","Faculdade de Ciências e Tecnologia da Universidade Nova de Lisboa","Material research in Europe"
"Carlos  Moedas","09/12/2014","Brussels","The Lisbon Council for Economic Competitiveness and Social Renewal asbl","Presentation of the activities of the Lisbon Council"
"Carlos  Moedas","04/12/2014","Brussels","Association des Constructeurs Européens d'Automobiles                                                                                    RENAULT","New technologies in the field of automotive, electric and connected vehicles in globalisation, EUCAR challenges."
"Carlos  Moedas","01/12/2014","Capetown","Bill & Melinda Gates Foundation","European & Developing Countries Clinical Trials Partnership"
"Federica Mogherini","04/03/2015","Berlaymont, Brussels","UniCredit","geopolitical developments"
"Federica Mogherini","03/02/2015","ChinaEu","ChinaEU","discussion on economic cooperation in the run up of the Summit"
"Pierre Moscovici","20/04/2015","Brussels, Belgium","European Newspaper Publishers' Association","TVA et presse en ligne"
"Pierre Moscovici","14/04/2015","Brussels, Belgium","Manufacture Française des Pneumatiques Michelin","compétitivité des entreprises européennes"
"Pierre Moscovici","14/04/2015","Bruxelles","ALSTOM","Situation de l'entreprise"
"Pierre Moscovici","13/04/2015","Paris","Société des Auteurs, Compositeurs et Editeurs de Musique","DSM"
"Pierre Moscovici","13/04/2015","Paris","HERMES INTERNATIONAL","DSM"
"Pierre Moscovici","27/03/2015","Paris","BNP PARIBAS","réforme bancaire et stabilité financière en Europe"
"Pierre Moscovici","20/03/2015","Paris","Suez Environnement","Economie Circulaire"
"Pierre Moscovici","20/03/2015","Bruxelles","GDF Suez","Economie Circulaire"
"Pierre Moscovici","19/03/2015","Brussels, Belgium","Foundation for an Open Society DOTS","Current european economic and fiscal issues"
"Pierre Moscovici","03/03/2015","Bruxelles","L'Oréal                                                                                    LVMH Publica","Parfumerie fine et dénaturants"
"Pierre Moscovici","19/02/2015","Bruxelles","Groupe des Grandes Entreprises françaises","Politique économique de la nouvelle Commission"
"Pierre Moscovici","19/02/2015","Bruxelles","ELECTRICITE DE FRANCE","Union Européenne de l'Energie"
"Pierre Moscovici","12/02/2015","Bruxelles","General Electric Company","Union européenne de l'Energie"
"Pierre Moscovici","22/01/2015","Davos","ArcelorMittal","Meeting with Mr Lakshmi Mittal"
"Pierre Moscovici","22/01/2015","Davos","George Soros","Meeting with George Soros"
"Pierre Moscovici","22/01/2015","Davos","Bridgewater","Meeting with Mr Dalio, Chairman, Bridgewater Associates"
"Pierre Moscovici","22/01/2015","Davos","Facebook","Meeting with Mr Kaplan, Vice-President Global, Facebook"
"Pierre Moscovici","22/01/2015","Davos","Bloomberg","Meeting with Mr Grauer, Global Chairman"
"Pierre Moscovici","22/01/2015","Davos","World Economic Forum","Meeting with Mr. Schwab, World Economic Forum"
"Pierre Moscovici","22/01/2015","Davos","Google","Meeting with Mr Drummond, Senior Vice President of Corporate Development, Google"
"Pierre Moscovici","16/01/2015","Paris","ELECTRICITE DE FRANCE","Union de l'Energie"
"Tibor Navracsics","30/04/2015","Brussels","The American College of Greece","Higher Education policy in Greece"
"Tibor Navracsics","23/04/2015","Brussels","European Federation for Intercultural Learning                                                                                    Y.E.S.-EWIV YOUTH AND EUROPEAN SOCIAL WORK- EUROPAISCHE WIRTSCHAFTLICHE INTERESSENVEREINIGUNG ZUR FORDERUNG DER HUMANRESSOURCEN                                                                                    European Confederation of Youth Clubs                                                                                    European Students' Union                                                                                    Youth for Exchange and Understanding                                                                                    European Educational Exchanges – Youth for Understanding                                                                                    Forum of European Muslim Youth and Student Organisations                                                                                    Jeunes Entrepreneurs de l'Union Européenne                                                                                    European Youth Forum                                                                                    European Youth Press                                                                                    European Union of Jewish Students","Tackling the radicalisation of young people"
"Tibor Navracsics","23/04/2015","Brussels","Fédération Internationale des Footballeurs Professionnelles Division Europe","Social dialogue in football"
"Tibor Navracsics","23/04/2015","Brussels","ELTE & UNICA","Higher education policy, including Erasmus+, EFSI abd the role of UNICA"
"Tibor Navracsics","01/04/2015","Brussels","Federation of European Publishers","Copyright, Educational publishing"
"Tibor Navracsics","30/03/2015","Stockholm, Sweden","European Club Association","Introductory meeting, exchange of views on major current issues affecting European club football and signature of a cooperation agreement on the European Week of Sport"
"Tibor Navracsics","24/03/2015","Brussels","Microsoft Corporation","Digital Education"
"Tibor Navracsics","23/03/2015","Brussels","Society of Audiovisual Authors","Copyright"
"Tibor Navracsics","23/03/2015","Brussels","The Russell Group of Universities","Higher Education policy"
"Tibor Navracsics","05/03/2015","Brussels","EUN Partnership aisbl","The meeting will address current and future cooperation between DG EAC and European Schoolnet (EUN); more specifically, what will be the vision and priorities for eTwinning and the School Education Gateway (SEG)."
"Tibor Navracsics","03/03/2015","Brussels","Federal Union of European Nationalities","The situation of minority languages in Europe"
"Tibor Navracsics","03/03/2015","Brussels","European Digital Media Association","Digital Single Market, Copyright"
"Tibor Navracsics","17/02/2015","Brussels","PRS for Music","Introductory meeting + copyright law"
"Tibor Navracsics","03/02/2015","Brussels","European Jewish Association","Introductory meeting and areas of common interests"
"Tibor Navracsics","29/01/2015","Brussels","Magyar Rektori Konferencia","Higher Education policy"
"Tibor Navracsics","29/01/2015","Brussels","Amazon Europe Core SARL","Minority languages, Multilingualism, Copyright"
"Tibor Navracsics","27/01/2015","Brussels, Belgium","European Youth Forum","Introductory meeting, exchange of views and priorities for youth policy 2015"
"Tibor Navracsics","27/01/2015","Brussels","European Union National Institutes for Culture","Copyright"
"Tibor Navracsics","22/01/2015","Brussels","German Rectors' Conference","Cooperation in Higher education"
"Tibor Navracsics","20/01/2015","Brussels","General Electric Company","Meeting with GE"
"Tibor Navracsics","19/01/2015","Brussels","Société des Auteurs, Compositeurs et Editeurs de Musique","Copyright"
"Tibor Navracsics","12/01/2015","Brussels","European Union Youth Orchestra","Introductory meeting"
"Tibor Navracsics","11/12/2014
            	     
            	     	(Cancelled)","Brussels","Platform of European Memory and Conscience","European Memory and Conscience"
"Tibor Navracsics","09/12/2014","Brussels","European Magazine Media Association","Exchange of views and priorities for the culture sector 2015"
"Tibor Navracsics","09/12/2014","Brussels","European Festivals Association","Exchange of views and priorities for the culture sector 2015"
"Tibor Navracsics","08/12/2014","Brussels","Culture Action Europe","Exchange of views and priorities for the culture sector 2015"
"Tibor Navracsics","04/12/2014","Brussels, Belgium","EUROCHAMBRES – Association of European Chambers of Commerce and Industry","Education"
"Tibor Navracsics","04/12/2014","Brussels, Belgium","FIBA Europe e.V.","Home-grown players (HGP) in leagues around Europe"
"Tibor Navracsics","02/12/2014","Brussels","Groupement Européen des Sociétés d'Auteurs et Compositeurs","Exchange of views and priorities for the culture sector 2015"
"Günther H. Oettinger","20/02/2015","Mainz, Germany","Zweites Deutsches Fernsehen","Digital Economy and Society"
"Günther H. Oettinger","23/01/2015","Davos","Facebook","Digital Economy"
"Günther H. Oettinger","23/01/2015","Davos","Microsoft Corporation","Digital Single Market / digital skills"
"Günther H. Oettinger","21/01/2015","Brussels","Telenor","Digital Economy and Society"
"Günther H. Oettinger","19/01/2015","Brussels","Google","Digital Economy and Society"
"Günther H. Oettinger","14/01/2015","Berlin, Germany","Deutsche Telekom","Digital Economy and Society"
"Günther H. Oettinger","06/01/2015","Brussels","Vodafone Belgium SA","Digital Economy and Society"
"Günther H. Oettinger","18/12/2014","Strasbourg","European Telecommunications Network Operators' Association","Digital Economy and Society"
"Günther H. Oettinger","17/12/2014","Brussels","SES S.A.","Digital Economy and Society"
"Günther H. Oettinger","16/12/2014","Brussels","JPMorganChase & Co.","Digital Economy and Society"
"Günther H. Oettinger","11/12/2014","Brussels","BUSINESSEUROPE","Digital Agenda"
"Günther H. Oettinger","11/12/2014","Brussels","Fabasoft","Cloud"
"Günther H. Oettinger","11/12/2014","Brussels","Hewlett-Packard","Digital economy and society"
"Günther H. Oettinger","09/12/2014","Cologne, Germany","Wirtschaftsrat der CDU e.V.","Digital economy and society"
"Günther H. Oettinger","08/12/2014","Frankfurt, Germany","Industriegewerkschaft Metall","Digtal economy and society"
"Günther H. Oettinger","08/12/2014","Brussels","Telecom Italia","Developments EU telecom sector"
"Günther H. Oettinger","06/12/2014","Reutlingen, Germany","DIE FAMILIENUNTERNEHMER - ASU (RK Südwürttemberg)","Digital economy and society"
"Günther H. Oettinger","04/12/2014","Brussels","Mediaset","Digital economy and society"
"Günther H. Oettinger","04/12/2014","BERL 9","Mediaset SpA","Telecom Single Market/Audiovisual Policy/Copyright/Spectrum Policy"
"Günther H. Oettinger","04/12/2014","Brussels","Bundesvereinigung der Deutschen Arbeitgeberverbände e.V.","Digital Agenda"
"Günther H. Oettinger","02/12/2014","Brussels","LVMH Publica","Security and benefits of digital economy"
"Günther H. Oettinger","02/12/2014","Brussels","EKD-Büro Brüssel / EKD-Office Brussels","Courtesy call"
"Günther H. Oettinger","02/12/2014","Brussels","Fraunhofer-Gesellschaft","Digital Society"
"Günther H. Oettinger","02/12/2014","Brussels","Groupement Européen des Sociétés d'Auteurs et Compositeurs","Presentation of study"
"Maroš Šefčovič","27/04/2015","Brussels","UNIFE","Railway transport + Energy Union"
"Maroš Šefčovič","21/04/2015","Brussels","GDF SUEZ                                                                                    ČEZ, a.s.                                                                                    IBERDROLA                                                                                    GasTerra","Energy Union"
"Maroš Šefčovič","20/04/2015","Brussels","Eni S.p.A.                                                                                    E.ON                                                                                    GdF Suez                                                                                    PGNiG                                                                                    OMV                                                                                    RWE                                                                                                                        SPP                                                               Statoil","Gas storage"
"Maroš Šefčovič","20/03/2015","Brussels","Long-Term Infrastructure Investors Association","Investment in Infrastructure and Energy efficiency"
"Maroš Šefčovič","18/03/2015","Brussels","Eurochambres","Energy Union, general EU issues"
"Maroš Šefčovič","18/03/2015","Brussels","EMI","Energy Union and the citizens, energy union action plan and role of stakeholders"
"Maroš Šefčovič","04/03/2015","Brussels","Statnett","Energy Union, interconnections, digital dimension"
"Maroš Šefčovič","03/03/2015","Brussels","Wirtschaftsrat der CDU e.V.","Energy Union - security of supply"
"Maroš Šefčovič","24/02/2015","Brussels","CEEP - European Centre of Employers and Enterprises providing Public Services","Energy Union"
"Maroš Šefčovič","04/02/2015","Brussels","Eni S.p.A.","Presentation of ENI"
"Maroš Šefčovič","04/02/2015","Brussels, BE","BP p.l.c.","Energy Union"
"Maroš Šefčovič","03/02/2015","Brussels, BE","Green 10","Energy Union"
"Maroš Šefčovič","03/02/2015","Brussels, Be","GDF SUEZ","Energy Union"
