"Commissioner","Date","Location","Entity","Subject"
"Violeta Bulc","04/02/2015","Brussels, Belgium","Association des Constructeurs Européens d'Automobiles","Meeting with ACEA"
"Violeta Bulc","03/02/2015","Brussels, Belgium","European Transport Workers' Federation","Meeting with ETF"
"Violeta Bulc","29/01/2015","Brussels, Belgium","European Shippers' Council","Meeting with European Shippers' Council"
"Violeta Bulc","22/01/2015","Brussels, Belgium","Uber","Meeting with Uber"
"Violeta Bulc","20/01/2015","BERL 8/26","Deutsche Lufthansa AG                                                                                    AIR FRANCE","Presentation of Deutsche Lufthansa Group and Air France / KLM"
"Violeta Bulc","19/01/2015
            	     
            	     	(Cancelled)","Brussels, Belgium","Transport and Environment (European Federation for Transport and Environment)","Meeting with Transport&Environment"
"Violeta Bulc","19/01/2015","Brussels, Belgium","European Sea Ports Organisation","Meeting with ESPO"
"Violeta Bulc","15/01/2015","BERL","Airports Council International - European Region","Meeting ACI Europe"
"Violeta Bulc","15/01/2015","Brussels, Belgium","Union of European Chambers of Commerce for Transport","Meeting with UECC"
"Violeta Bulc","07/01/2015","Brussels, Belgium","International Air Transport Association","Meeting with IATA"
"Violeta Bulc","05/01/2015","Brussels, Belgium","Združenje Manager                                                                                    Alba Partners                                                                                    Agrokor","Meeting with associations"
"Violeta Bulc","23/12/2014","Ljubljana, Slovenia","BTC d.d.","Courtesy visit"
"Violeta Bulc","20/12/2014","Ajdovscina, Slovenia","Pipistrel d.o.o. Ajdovščina","Testing electric plane"
"Violeta Bulc","20/12/2014","Slovenia","Pipistrel d.o.o. Ajdovščina","Meeting with Pipistrel"
"Violeta Bulc","11/12/2014","Brussels, Belgium","European Rail Freight Association","Meeting with ERFA"
"Violeta Bulc","09/12/2014","Paris, France","Aéroports de Paris","Meeting with AdP"
"Violeta Bulc","09/12/2014","Paris, France","Société Nationale des Chemins de Fer Français","Meeting with SNCF"
"Corina Creţu","17/03/2015","BERL","European Alliance to Save Energy","Meeting between Commissioner Cretu and Monica Frassoni, President EU-ASE"
"Corina Creţu","27/01/2015","Brussels","CEE Bankwatch Network","CEE Bankwatch Network"
"Valdis Dombrovskis","05/05/2015","European Commission –Brussels","Green Budget Europe                                                                                     European Environmental Bureau                                                                                     WWF EPO","Environmental aspects of the European semester"
"Valdis Dombrovskis","05/05/2015
            	     
            	     	(Cancelled)","European Commission – Berlaymont - Brussels","European Environmental Bureau                                                                                      WWF EPO","Environmental aspects of the European semester"
"Valdis Dombrovskis","23/04/2015","Riga - Radisson Blu Hotel Latvija","EUROFI","EU financial markets"
"Valdis Dombrovskis","23/04/2015","Riga - Radisson Blu Hotel Latvija","The Goldman Sachs Group","Capital Markets Union – State of EU/US banking markets"
"Valdis Dombrovskis","24/03/2015","European Commission, Brussels","Platform of European Social NGOs","Meeting held in the context of closer involvement of civil society in the European Semester. Topics discussed: EU economic governance. Streamlining of the European Semester: COM analysis in Country Reports and the involvement of civil society organizations. Mid-term review of Europe 2020 strategy."
"Valdis Dombrovskis","19/03/2015","Hotel Royal Windsor - Brussels","European Savings and Retail Banking Group","Keynote speech at the ESBG Retail Banking conference"
"Valdis Dombrovskis","17/03/2015","European Commission, Brussels","European Anti Poverty Network","EU macroeconomic governance, streamlining of the European Semester, role of social indicators. Midterm review of Europe 2020 strategy, progress towards headline targets, including poverty reduction target."
"Valdis Dombrovskis","13/03/2015","Helsinki","Elinkeinoelämän Valtuuskunta EVA ry","Recent economic developments in the Euro-Zone"
"Valdis Dombrovskis","06/03/2015","European Commission –Brussels (Berlaymont)","Deutscher Sparkassen-und Giroverband","Banking regulatory issues – European semester"
"Valdis Dombrovskis","04/03/2015","European Commission –Brussels (Berlaymont)","UniCredit","Banking regulatory issues – Capital banking structure – Financing of the economy"
"Valdis Dombrovskis","28/01/2015","European Commission, Brussels","Deutscher Gewerkschaftsbund","Strengthening the Social Dialogue at the European and national level; European Economic Governance"
"Valdis Dombrovskis","27/01/2015","European Commission - BERL","Commerzbank AG","Banking Union"
"Valdis Dombrovskis","27/01/2015","European Commission - BERL","BlackRock","CMU"
"Valdis Dombrovskis","21/01/2015","Davos Congress Centre,Talstrasse 41, CH-7270  Davos, Switzerland","AT&T, Inc.","Latest developments in the European market, economic growth and job creation in Europe; key policy issues such as corporate governance, information and technology, international trade, smart regulation, and tax and fiscal policy. European Investment plan."
"Valdis Dombrovskis","21/01/2015","Davos Congress Centre,Talstrasse 41, CH-7270  Davos, Switzerland","Bank of America","Eurozone macro-economic outlook and the Banking Union as it currently stands, as well as the state of the European and American economy"
"Valdis Dombrovskis","16/01/2015","Brussels","Air Baltic Corporation AS","Exchange of views"
"Valdis Dombrovskis","11/12/2014","AmCham EU office, on Avenue des Arts 53, 1000 Brussels","United Technologies Corporation                                                                                    American Chamber of Commerce to the European Union                                                                                    SAS Institute                                                                                    Marco Comastri, President EMEA, CA Technologies                                                                                    3M                                                                                    Dell Inc                                                                                    Nigel Lewis, Vice President, EAME Distribution Services Division, Caterpillar                                                                                    UPS Europe SPRL/BVBA                                                                                    Intel Corporation                                                                                    Julián Nebreda, Corporate Vice President for Europe, Middle East, Africa & CIS, AES                                                                                    Dirk Ostijn, Regional Head Western Europe & Chief Executive Officer for Metlife Europe Limited, Metlife                                                                                    Dow Corning Europe                                                                                    Hewlett-Packard                                                                                    Accenture International SARL                                                                                    Oracle                                                                                    IBM Corporation","Presentation of the Annual Growth Survey 2015 outlining the main priorities for the jobs and growth agenda /in the context of the flagship conference ‘Reinvigorating the European Economy: Policies to Foster Jobs, Growth and Innovation’"
"Kristalina Georgieva","21/03/2015","BERL","Open Society European Policy Institute","Meeting with George Soros in margins of GMF Forum Brussels"
"Kristalina Georgieva","17/02/2015","BERL","Transparency International Liaison Office to the European Union","Meeting with Carl Dolan, Director of Transparency International, Brussels office"
"Kristalina Georgieva","27/01/2015","Brussels","International Rescue Committee Inc","Budgetary situation of EU external assistance; hot crises"
"Kristalina Georgieva","16/01/2015","BERL","Vienna Economic Forum","Meeting with Dr Elena Kirtcheva-Discussing eventual participation of VP Georgieva in Vienna Economic Forum"
"Johannes Hahn","19/03/2015
            	     
            	     	(Cancelled)","Brussels","Foundation for an Open Society DOTS","Situation in Ukraine and support from the EU"
"Johannes Hahn","19/03/2015","Brussels","Foundation for an Open Society DOTS","Situation in Ukraine and support from the EU"
"Johannes Hahn","19/03/2015
            	     
            	     	(Cancelled)","Brussels","Foundation for an Open Society DOTS","Situation in Ukraine and support from the EU"
"Johannes Hahn","18/02/2015","Pristina, Kosovo","Kosovo Business Community","Meeting with Business Community"
"Johannes Hahn","03/12/2014","Brussels","TUSIAD","Economic development in Turkey"
"Jonathan Hill","08/05/2015","London","The Investment Association","Financial Services Policy"
"Jonathan Hill","08/05/2015","London","Association of British Insurers","Financial Services Policy"
"Jonathan Hill","01/05/2015","London","Which?","Financial Services Policy"
"Jonathan Hill","21/04/2015","Brussels","Institute of Directors","Financial Service Policy"
"Jonathan Hill","17/04/2015","London","EEF, the manufacturers' organisation","Financial Services Policy"
"Jonathan Hill","16/04/2015","Brussels","Rolls Royce","Financial Services Policy"
"Jonathan Hill","15/04/2015","Brussels","Schweizerische Bankiervereinigung","Introductory Meeting"
"Jonathan Hill","30/03/2015","Brussels","APG Groep N.V","Asset management issues"
"Jonathan Hill","26/03/2015","Belgium, Brussels, BERL","Deutsche Bank AG","Banking Structural Reform"
"Jonathan Hill","25/03/2015","Brussels","EuropeanIssuers","Capital Markets Union"
"Jonathan Hill","18/03/2015","Brussels","Association of European Businesses","Financial Services Policy"
"Jonathan Hill","17/03/2015","Frankfurt am Main, Germany","Bundesverband deutscher Banken e.V.","Financial regulation"
"Jonathan Hill","16/03/2015","Frankfurt am Main, Germany","Deutsche Börse AG","Central counterparties"
"Jonathan Hill","16/03/2015","Frankfurt am Main, Germany","Bettervest GmbH                                                                                    wetransform GmbH                                                                                    Brain AG","Capital markets union"
"Jonathan Hill","13/03/2015","London","The Goldman Sachs Group, Inc.","Financial Services Policy"
"Jonathan Hill","13/03/2015","London","Open Europe","Financial Services Policy"
"Jonathan Hill","12/03/2015","Edinburgh","National Association of Pension Funds","Financial Services Policy"
"Jonathan Hill","06/03/2015","Belgium, Brussels, BERL","Union européenne de l'Artisanat et des petites et moyennes entreprises, aisbl","Capital Markets Union + SMEs"
"Jonathan Hill","05/03/2015","Belgium, Brussels, BERL","BUSINESSEUROPE","Capital Markets Union + industry"
"Jonathan Hill","05/03/2015","Brussels","UniCredit","Banking issues"
"Jonathan Hill","04/03/2015","Brussels","Österreichischer Sparkassenverband","Introductory meeting, Capital Markets Union, Retail financial services"
"Jonathan Hill","03/03/2015","Brussels","ING Group","Overview of Financial Services policy"
"Jonathan Hill","27/02/2015","New York","Intercontinental Exchange","EU and US Regulatory Agenda in Financial Services"
"Jonathan Hill","27/02/2015","New York","BlackRock","EU and US Regulatory Agenda in Financial Services"
"Jonathan Hill","27/02/2015","New York","Managed Funds Association","EU and US Regulatory Agenda in Financial Services"
"Jonathan Hill","26/02/2015","New York","The Goldman Sachs Group, Inc.","EU and US Regulatory Agenda in Financial Services"
"Jonathan Hill","20/02/2015","London","Barclays PLC","Financial Services Policy"
"Jonathan Hill","20/02/2015","London","Morgan Stanley","Financial Services Policy"
"Jonathan Hill","20/02/2015","London","Financial Reporting Council","Financial Services Policy"
"Jonathan Hill","19/02/2015","Brussels","Euronext","Markets in Financial Instruments Directive (MiFID)/Capital Markets Union/European Market Infrastructure Regulation (EMIR)"
"Jonathan Hill","18/02/2015","Brussels","Fédération Française des Sociétés d'Assurances","IORP II, Solvency II, CMU"
"Jonathan Hill","18/02/2015","Brussels","Bundesverband Investment und Asset Management e.V.","Markets in Financial Instruments Directive (MiFID)/Capital Markets Union (CMU)"
"Jonathan Hill","13/02/2015","Brussels","KfW Bankengruppe","Banking and markets"
"Jonathan Hill","12/02/2015","Brussels","Society for Worldwide Interbank Financial Telecommunication","Financial Services Policy"
"Jonathan Hill","05/02/2015","Brussels","BP p.l.c.","Introductory Meeting"
"Jonathan Hill","30/01/2015","Brussels","Aviva Plc","Capital Markets Union"
"Jonathan Hill","30/01/2015","Brussels","FIA Europe","Introductory Meeting"
"Jonathan Hill","29/01/2015","Brussels","Investor AB","Corporate governance; long-term investment access to risk capital for European companies"
"Jonathan Hill","29/01/2015","Brussels","European Union Chamber of Commerce in China","Introductory Meeting"
"Jonathan Hill","29/01/2015","Brussels","European Fund and Asset Management Association","CMU, Long-term savings, Product disclosure"
"Jonathan Hill","28/01/2015","Brussels","TheCityUK","Financial Services Policy"
"Jonathan Hill","27/01/2015","Brussels","Association for Financial Markets in Europe","Capital Markets Union"
"Jonathan Hill","27/01/2015","Brussels","Commerzbank AG","BSR, TLAC, CMU"
"Jonathan Hill","27/01/2015","Brussels","BlackRock","ELTIF, CMU"
"Jonathan Hill","26/01/2015","Brussels","International Capital Market Association","Capital Markets Union"
"Jonathan Hill","23/01/2015","London, UK","New Financial","Financial Services Policy"
"Jonathan Hill","23/01/2015","London, UK","London Stock Exchange Group","Financial Service Policy"
"Jonathan Hill","23/01/2015
            	     
            	     	(Cancelled)","London. UK","London Stock Exchange","Financial Services Policy"
"Jonathan Hill","23/01/2015","London","London Stock Exchange Group","Introductory Meeting"
"Jonathan Hill","22/01/2015","Brussels","BNP PARIBAS","Financial Services Policy 2015 especially capital markets union"
"Jonathan Hill","21/01/2015","Brussels","Western Union Company","Financial Services Policy"
"Jonathan Hill","20/01/2015","Brussels","UBS AG","Implementation/completion of the financial reform/prospects for further financial regulation and CMU"
"Jonathan Hill","19/01/2015","Brussels, BERL 10th floor","International Financial Reporting Standards (IFRS) Foundation","IFRS"
"Jonathan Hill","12/01/2015","Brussels","EUROPEAN TRADE UNION CONFEDERATION","Introductory meeting + discussion of priorities for 2015 in financial services"
"Jonathan Hill","17/12/2014","Brussels","Insurance Europe","Insurers' major role as institutional investors in the European economy"
"Jonathan Hill","15/12/2014","Brussels","HSBC Holdings PLC","Bank stress tests, LCR, CMU, Bank structural reform, TLAC"
"Jonathan Hill","09/12/2014","Brussels","Prime Collateralised Securities (PCS) UK Limited","Securitisation aspects of CMU and CMU more broadly, PCS initiative"
"Jonathan Hill","09/12/2014","Brussels, Belgium","European Banking Federation","Financial services: priorities for 2015 including Capital Markets Union"
"Jonathan Hill","04/12/2014","Brussels - Belgium","EUROCHAMBRES – Association of European Chambers of Commerce and Industry","Financial and capital markets policy"
"Jonathan Hill","04/12/2014","Brussels","Intercontinental Exchange","Introductory meeting"
"Jonathan Hill","02/12/2014","Brussels","London Stock Exchange Group","Financial Services Policy"
"Jonathan Hill","02/12/2014","Brussels","Federation of European Securities Exchanges","Capital Markets Union"
"Phil Hogan","05/02/2015","Brussels","Landbrug & Fødevarer - Danish Agriculture and Food Council","Simplification, Greening, Fat tax, Pig price crisis, ammonia emissions"
"Phil Hogan","23/01/2015","Dublin","Northern Ireland Meat Exporters Association","Current Agricultural Issues"
"Phil Hogan","23/01/2015","DUBLIN","Ibec","Commissioner work programme for 2015 and policy priorities for the 5 year term as Commissionr."
"Phil Hogan","23/01/2015","Dublin, Ireland","Ibec","Meeting board of Directors of IBEC to discuss Commission Work Programme"
"Phil Hogan","23/01/2015","Dublin, Ireland","Northern Ireland Meat Exporters Association","Nomad cattle and exporting to 3rd countries"
"Phil Hogan","22/01/2015","Brussels","European Milk Board","Dairy policy. Supply management. Increased production costs and exodus of European dairy farmers out of the industry."
"Phil Hogan","17/01/2015","Berlin","Deutscher Bauernverband","General Presentation by the Bauernverband: handing over of simplifiction proposals and explanation of those proposals"
"Phil Hogan","09/01/2015","Brussels","Ulster Farmers Union","Current Agriculture Issues"
"Phil Hogan","18/12/2014","Brussels","Irish Cattle & Sheep Farmers' Association Ltd","Ireland Rural development programme. LPIS"
"Phil Hogan","12/12/2014","Brussels","Irish Farmers' Association","Ireland Rural Development Programme, Milk market measures, Commonage problems in Ireland"
"Phil Hogan","10/12/2014","Brussels","Danish Dairy Board Brussels s.a.","Milk market measures. Debt levels in Denmark"
"Phil Hogan","05/12/2014","Brussels","European Council of Young farmers","Current Agriculture Issues"
"Phil Hogan","04/12/2014","Brussels","European Farmers","Simplification, Farmers share of retail, TTIP, Commissioners address to COPA Presidium"
"Phil Hogan","03/12/2014","US Dairy Export Council","US Dairy Export Council","TTIP & Geographical indications"
"Phil Hogan","02/12/2014","Brussels","Irish Creamery Milk Suppliers Association","Milk price pressures for 2015, superlevy fines, measures to support to dairy farmers, TTIP"
"Věra Jourová","23/03/2015","Brussels, Belgium","CECED (European Committee of Domestic Equipment Manufacturers)","Consumer product safety and long-term planning"
"Věra Jourová","23/03/2015","Brussels, Belgium","Council of Bars and Law Societies of Europe","Presentation of the activites of the Council of Bars and Law Societies of Europe (CCBE), including CCBE's position on EPPO, data protection, access to a lawyer"
"Věra Jourová","19/03/2015","Brussels, Belgium","Open Society European Policy Institute","Roma issues"
"Věra Jourová","18/03/2015","Brussels, Belgium","EUROCHAMBRES – Association of European Chambers of Commerce and Industry","Discussion on long-term priorities"
"Věra Jourová","11/03/2015","Brussels, Belgium","European Federation of National Associations of Measurement, Testing and Analytical Laboratories (EUROLAB)","Standardisation and international agreements"
"Věra Jourová","16/02/2015","Brussels, Belgium","Open Society European Policy Institute                                                                                    European Network Against Racism                                                                                    Platform of European Social NGOs                                                                                    Amnesty International European Institutions Office                                                                                    European Women's Lobby                                                                                    The European Region of the International Lesbian, Gay, Bisexual, Trans and Intersex Association                                                                                    AGE Platform Europe                                                                                    The International Lesbian, Gay, Bisexual, Transgender & Queer Youth & Student Organisation                                                                                    European Disability Forum","Equal Treatment Directive"
"Věra Jourová","10/02/2015","Strasbourg, France","ČEZ, a.s.","Energy Union and Women on Boards proposal"
"Věra Jourová","05/02/2015","Brussels, Belgium","Amnesty International European Institutions Office","Fundamental Rights and Hate speech"
"Věra Jourová","03/02/2015","Brussels, Belgium","European Judicial Training Network","Presentation of EJTN activities"
"Věra Jourová","02/02/2015","Brussels, Belgium","Deutsche Telekom                                                                                    Orange                                                                                    Telefonica, S.A.","Digital Single Market"
"Věra Jourová","26/01/2015","Prague, Czech Republic","Notářská komora České republiky","Commission's legislative actions and proposals on public documents"
"Věra Jourová","22/01/2015","Brussels, Belgium","ERGO Network","Presentation of the network, exchange of views"
"Věra Jourová","20/01/2015","Brussels, Belgium","Microsoft Corporation","Data protection"
"Věra Jourová","19/01/2015","Brussels, Belgium","European Law Institute","ELI-EU relations, EU projects"
"Věra Jourová","19/01/2015","Brussels, Belgium","Google","Data protection"
"Věra Jourová","16/01/2015","PRAGUE, CZECH REPUBLIC","SODEXO                                                                                    ČEZ, a.s.                                                                                    GlaxoSmithKline                                                                                    Microsoft Corporation                                                                                    IBM Corporation                                                                                    ABB                                                                                    Accenture International SARL                                                                                    Novartis International AG                                                                                    Erste Group Bank AG","Round Table on Gender Diversity"
"Věra Jourová","14/01/2015","Brussels, Belgium","BUSINESSEUROPE","Company law, Consumer protection/Product Safety, Data Protection, Gender Equality"
"Věra Jourová","09/01/2015","Brussels, Belgium","The European Region of the International Lesbian, Gay, Bisexual, Trans and Intersex Association                                                                                    AGE Platform Europe                                                                                    European Disability Forum                                                                                    Platform of European Social NGOs                                                                                    European Women's Lobby                                                                                    International Federation for Human Rights                                                                                    European Council on Refugees and Exiles                                                                                    European Network Against Racism                                                                                    European Youth Forum                                                                                    European Network on Religion and Belief                                                                                    Human Rights Watch","Roundtable with NGOs on fundamental rights and non-discrimination"
"Věra Jourová","18/12/2014","Brussels, Belgium","European Women's Lobby","Gender equality"
"Věra Jourová","17/12/2014","Brussels, Belgium","Bureau Européen des Unions de Consommateurs","Consumer protection"
"Věra Jourová","09/12/2014","Brussels, Belgium","Open Society European Policy Institute","Non-discrimination policies"
"Jyrki Katainen","13/04/2015","Brussels","Confederation of European Paper Industries","Paper Industry; Competitiveness"
"Jyrki Katainen","30/03/2015","Brussels","UNI Europa","Good quality services & jobs"
"Jyrki Katainen","26/03/2015","Brussels","Bureau Européen des Unions de Consommateurs","EU Consumer affairs"
"Jyrki Katainen","20/03/2015","Brussels","Insurance Europe","Investment Initiative"
"Jyrki Katainen","19/03/2015","Brussels","EUROCHAMBRES – Association of European Chambers of Commerce and Industry","Investment Package and SMEs"
"Jyrki Katainen","11/03/2015","Strasbourg","Neste Oil","Investment Package"
"Jyrki Katainen","09/03/2015","Brussels","European Round Table of Industrialists","Industrial policy"
"Jyrki Katainen","09/03/2015","Brussels","Elisa Oyj","Digital Single Market"
"Jyrki Katainen","13/02/2015","Brussels","Green 10","Green growth and Circular Economy"
"Jyrki Katainen","12/02/2015","Brussels","General Electric Company","Investment Plan"
"Jyrki Katainen","09/02/2015","Brussels","Inmarsat Global Ltd","Investments and competitiveness"
"Jyrki Katainen","04/02/2015","Brussels","TeliaSonera AB","Digital Single Market"
"Jyrki Katainen","04/02/2015","Brussels","Association des Constructeurs Européens d'Automobiles","Regulatory framework for automotive"
"Jyrki Katainen","03/02/2015","Brussels","EuropaBio","Bioeconomy"
"Jyrki Katainen","03/02/2015","Brussels","ChinaEU","ICT investments"
"Jyrki Katainen","28/01/2015","Brussels","Gasum Oy","Energy Policy"
"Jyrki Katainen","28/01/2015","Brussels","Rovio","Digital Single Market"
"Jyrki Katainen","27/01/2015","Brussels","Nokia","Digital Single Market"
